{
  "schema_version": "1.0",
  "basics": {
    "name": "Jake Ryan",
    "phone": "123-456-7890",
    "email": "jake@su.edu",
    "links": [
      {
        "url": "https://linkedin.com/in/jake"
      },
      {
        "url": "https://github.com/jake"
      }
    ]
  },
  "section_order": [
    "education",
    "experience",
    "custom-volunteer",
    "projects",
    "custom-certs",
    "skills",
    "custom-languages"
  ],
  "education": [
    {
      "school": "Southwestern University",
      "location": "Georgetown, TX",
      "degree": "Bachelor of Arts in Computer Science, Minor in Business",
      "start": "Aug. 2018",
      "end": "May 2021"
    },
    {
      "school": "Blinn College",
      "location": "Bryan, TX",
      "degree": "Associate's in Liberal Arts",
      "start": "Aug. 2014",
      "end": "May 2018"
    }
  ],
  "experience": [
    {
      "company": "Texas A&M University",
      "location": "College Station, TX",
      "roles": [
        {
          "title": "Undergraduate Research Assistant",
          "start": "June 2020",
          "end": "Present",
          "bullets": [
            "Developed a REST API using FastAPI and PostgreSQL to store data from learning management systems",
            "Developed a full-stack web application using Flask, React, PostgreSQL and Docker to analyze GitHub data",
            "Explored ways to visualize GitHub collaboration in a classroom setting"
          ]
        }
      ]
    },
    {
      "company": "Southwestern University",
      "location": "Georgetown, TX",
      "roles": [
        {
          "title": "Information Technology Support Specialist",
          "start": "Sep. 2018",
          "end": "Present",
          "bullets": [
            "Communicate with managers to set up campus computers used on campus",
            "Assess and troubleshoot computer problems brought by students, faculty and staff",
            "Maintain upkeep of computers, classroom equipment, and 200 printers across campus"
          ]
        }
      ]
    },
    {
      "company": "Southwestern University",
      "location": "Georgetown, TX",
      "roles": [
        {
          "title": "Artificial Intelligence Research Assistant",
          "start": "May 2019",
          "end": "July 2019",
          "bullets": [
            "Explored methods to generate video game dungeons based off of The Legend of Zelda",
            "Developed a game in Java to test the generated dungeons",
            "Contributed 50K+ lines of code to an established codebase via Git",
            "Conducted a human subject study to determine which video game dungeon generation technique is enjoyable",
            "Wrote an 8-page paper and gave multiple presentations on-campus",
            "Presented virtually to the World Conference on Computational Intelligence"
          ]
        }
      ]
    }
  ],
  "projects": [
    {
      "name": "Gitlytics",
      "tech": [
        "Python",
        "Flask",
        "React",
        "PostgreSQL",
        "Docker"
      ],
      "start": "June 2020",
      "end": "Present",
      "bullets": [
        "Developed a full-stack web application using with Flask serving a REST API with React as the frontend",
        "Implemented GitHub OAuth to get data from user’s repositories",
        "Visualized GitHub data to show collaboration",
        "Used Celery and Redis for asynchronous tasks"
      ]
    },
    {
      "name": "Simple Paintball",
      "tech": [
        "Spigot API",
        "Java",
        "Maven",
        "TravisCI",
        "Git"
      ],
      "start": "May 2018",
      "end": "May 2020",
      "bullets": [
        "Developed a Minecraft server plugin to entertain kids during free time for a previous job",
        "Published plugin to websites gaining 2K+ downloads and an average 4.5/5-star review",
        "Implemented continuous delivery using TravisCI to build the plugin upon new a release",
        "Collaborated with Minecraft server administrators to suggest features and get feedback about the plugin"
      ]
    }
  ],
  "skills": [
    {
      "category": "Languages",
      "items": [
        "Java",
        "Python",
        "C/C++",
        "SQL (Postgres)",
        "JavaScript",
        "HTML/CSS",
        "R"
      ]
    },
    {
      "category": "Frameworks",
      "items": [
        "React",
        "Node.js",
        "Flask",
        "JUnit",
        "WordPress",
        "Material-UI",
        "FastAPI"
      ]
    },
    {
      "category": "Developer Tools",
      "items": [
        "Git",
        "Docker",
        "TravisCI",
        "Google Cloud Platform",
        "VS Code",
        "Visual Studio",
        "PyCharm",
        "IntelliJ",
        "Eclipse"
      ]
    },
    {
      "category": "Libraries",
      "items": [
        "pandas",
        "NumPy",
        "Matplotlib"
      ]
    }
  ],
  "custom_sections": [
    {
      "id": "custom-volunteer",
      "title": "Volunteer Experience",
      "layout": "entries",
      "entries": [
        {
          "title": "Tutor",
          "organization": "Hamilton Public Library",
          "location": "Hamilton, ON",
          "start": "Sept. 2023",
          "end": "Present",
          "bullets": [
            "Tutored 12 high school students in Python and math each week"
          ]
        }
      ]
    },
    {
      "id": "custom-certs",
      "title": "Certifications",
      "layout": "list",
      "items": [
        "AWS Certified Cloud Practitioner (2024)",
        "Microsoft Azure Fundamentals AZ-900 (2023)"
      ]
    },
    {
      "id": "custom-languages",
      "title": "Languages",
      "layout": "categories",
      "categories": [
        {
          "category": "Spoken",
          "items": [
            "English",
            "Arabic",
            "French"
          ]
        }
      ]
    }
  ]
}